[
  {
    "id": "s0",
    "schemaVersion": 2,
    "displayKey": "scenario.s0",
    "active": true,
    "status": "approved",
    "kind": "prologue",
    "stage": "S0",
    "emotionKey": "남겨진 열쇠",
    "prevDay": null,
    "nextDay": "d1",
    "unlocks": ["menu-negima"],
    "fallbackNote": "열쇠·대문 두 상호작용은 실패·점수·경제 결과 없이 순서대로 완료하며 점화는 후속 이야기 대사로 전한다.",
    "entryConditionId": "campaign-start",
    "completionConditionId": "s0-two-interactions-complete",
    "scenes": [
      {
        "id": "SCN-S0-DECISION",
        "timing": "post-interaction",
        "skipSummary": [
          "할아버지의 열쇠로 가게를 다시 열었다.",
          "화로의 숯불이 다시 붙었다.",
          "D1 목표: 네기마와 생맥주로 첫 손님을 맞는다."
        ]
      }
    ],
    "skipSummary": [
      "열쇠로 닫힌 가게를 열었다.",
      "화로의 숯불이 다시 붙었다.",
      "하루만 영업하기로 했다."
    ],
    "interactions": [
      {
        "id": "S0-KEY-SELECT",
        "sequence": 1,
        "failurePolicy": "no-failure",
        "commandId": "select-inherited-key"
      },
      {
        "id": "S0-GATE-OPEN",
        "sequence": 2,
        "failurePolicy": "no-failure",
        "commandId": "open-shop-gate"
      }
    ],
    "readOnly": false,
    "gameplayCommandIds": [
      "select-inherited-key",
      "open-shop-gate"
    ],
    "economyCommandIds": [],
    "reward": {
      "growthResultIds": ["menu-negima"],
      "storyFlagIds": ["s0-complete"]
    }
  },
  {
    "id": "d1",
    "schemaVersion": 2,
    "displayKey": "scenario.d1",
    "active": true,
    "status": "approved",
    "kind": "business-day",
    "stage": "D1",
    "emotionKey": "첫 영업",
    "prevDay": "s0",
    "nextDay": "d2",
    "dayDataId": "d1",
    "unlocks": ["menu-momo", "day-d2"],
    "fallbackNote": "첫 주문은 네기마와 생맥주로 고정하며 일반 손님은 같은 수량의 엑스트라 유형으로 대체할 수 있다.",
    "entryConditionId": "s0-complete",
    "completionConditionId": "d1-settlement-complete",
    "scenes": [
      {
        "id": "SCN-D1-PREOPEN",
        "timing": "pre-open",
        "skipSummary": [
          "첫 손님 츠키오카 세이지가 찾아왔다.",
          "생맥주 부분 제공과 네기마 2개 조리를 배운다.",
          "D1 목표: 첫 주문을 끝까지 안전하게 완성한다."
        ]
      },
      {
        "id": "SCN-D1-POST",
        "timing": "post-settlement",
        "skipSummary": [
          "첫 영업과 정산을 마쳤다.",
          "모모 페이지의 일부가 읽히기 시작했다.",
          "D2 목표: 도움 없이 기본 조리 흐름을 반복한다."
        ]
      }
    ],
    "skipSummary": [
      "츠키오카의 첫 주문을 끝까지 완료한다.",
      "직장인 둘과 혼술 손님을 응대한다.",
      "정산 뒤 모모와 D2를 연다."
    ],
    "interactions": [],
    "readOnly": false,
    "gameplayCommandIds": ["begin-day", "accept-order", "serve-item", "cleanup-seat", "complete-settlement"],
    "economyCommandIds": ["record-sale", "record-tip", "apply-settlement"],
    "reward": {
      "growthResultIds": ["menu-momo", "day-d2"],
      "storyFlagIds": ["d1-complete", "momo-restored"]
    }
  },
  {
    "id": "d2",
    "schemaVersion": 2,
    "displayKey": "scenario.d2",
    "active": true,
    "status": "approved",
    "kind": "business-day",
    "stage": "D2",
    "emotionKey": "손의 리듬",
    "prevDay": "d1",
    "nextDay": "d3",
    "dayDataId": "d2",
    "unlocks": ["day-d3"],
    "fallbackNote": "엑스트라 유형이 없으면 같은 그룹 크기의 혼술족 또는 직장인 유형으로 대체한다.",
    "entryConditionId": "d1-settlement-complete",
    "completionConditionId": "d2-settlement-complete",
    "scenes": [
      {
        "id": "SCN-D2-PREOPEN",
        "timing": "pre-open",
        "skipSummary": [
          "D2에 모모와 재방문 손님이 들어온다.",
          "기본 조리 안내가 줄어든다.",
          "D2 목표: 주문과 준비 목록을 스스로 확인한다."
        ]
      },
      {
        "id": "SCN-D2-POST",
        "timing": "post-settlement",
        "skipSummary": [
          "모모 첫 판매와 기본 조리를 마쳤다.",
          "이름 없는 손님이 재방문 의사를 남겼다.",
          "D3 목표: 조립대에서 소금·타레를 나누고 타레는 한 번의 붓질로 준비한다."
        ]
      }
    ],
    "skipSummary": [
      "도움이 줄어든 기본 조리를 복습한다.",
      "모모를 처음 판매한다.",
      "정산 뒤 D3를 연다."
    ],
    "interactions": [],
    "readOnly": false,
    "gameplayCommandIds": ["begin-day", "accept-order", "serve-item", "cleanup-seat", "complete-settlement"],
    "economyCommandIds": ["record-sale", "record-tip", "apply-settlement"],
    "reward": {
      "growthResultIds": ["day-d3"],
      "storyFlagIds": ["d2-complete", "momo-first-sale"]
    }
  },
  {
    "id": "d3",
    "schemaVersion": 2,
    "displayKey": "scenario.d3",
    "active": true,
    "status": "approved",
    "kind": "business-day",
    "stage": "D3",
    "emotionKey": "조립대의 타레 한 붓",
    "prevDay": "d2",
    "nextDay": "d4",
    "dayDataId": "d3",
    "unlocks": ["day-d4", "menu-cabbage-salad", "menu-highball"],
    "fallbackNote": "타레 주문은 유지하며 특수 엑스트라가 없으면 기본 엑스트라 유형으로 대체한다.",
    "entryConditionId": "d2-settlement-complete",
    "completionConditionId": "d3-settlement-complete",
    "scenes": [
      {
        "id": "SCN-D3-PREOPEN",
        "timing": "pre-open",
        "skipSummary": [
          "D3부터 조립을 마친 꼬치에 소금·타레를 고른다.",
          "소금 꼬치는 바로 그릴 재고로 보내고 타레는 소스통을 선택한다.",
          "조립대에서 꼬치 위를 좌우로 한 번 고르게 칠하면 타레 재고가 된다."
        ]
      },
      {
        "id": "SCN-D3-POST",
        "timing": "post-settlement",
        "skipSummary": [
          "조립대에서 타레 꼬치를 한 번의 붓질로 준비했다.",
          "가게를 소개해도 되는지 묻는 손님이 생겼다.",
          "다음 목표: D4의 사이드 메뉴를 준비한다."
        ]
      }
    ],
    "skipSummary": [
      "조립대에서 완성한 꼬치를 소금·타레 재고로 나눈다.",
      "타레 꼬치는 조립대의 소스통과 한 번의 좌우 붓질로 준비한다.",
      "정산 뒤 양배추 사라다와 하이볼을 준비하는 D4를 연다."
    ],
    "interactions": [],
    "readOnly": false,
    "gameplayCommandIds": ["begin-day", "accept-order", "select-assembly-seasoning", "brush-assembly-tare", "serve-item", "cleanup-seat", "complete-settlement"],
    "economyCommandIds": ["record-sale", "record-tip", "apply-settlement"],
    "reward": {
      "growthResultIds": ["day-d4", "menu-cabbage-salad", "menu-highball"],
      "storyFlagIds": ["d3-complete", "tare-introduced"]
    }
  },
  {
    "id": "d4",
    "schemaVersion": 2,
    "displayKey": "scenario.d4",
    "active": true,
    "status": "approved",
    "kind": "business-day",
    "stage": "D4",
    "emotionKey": "넓어진 카운터",
    "prevDay": "d3",
    "nextDay": "d5",
    "releaseDataId": "d4-business-day-domain.v1",
    "unlocks": ["day-d5", "menu-kawa"],
    "fallbackNote": "사라다와 하이볼은 D4 release definition을 기준으로 제공하며 전용 아트가 없을 때도 동일한 스테이션 조작과 주문 완료 조건을 유지한다.",
    "entryConditionId": "d3-settlement-complete",
    "completionConditionId": "d4-settlement-complete",
    "scenes": [
      {
        "id": "SCN-D4-PREOPEN",
        "timing": "pre-open",
        "skipSummary": [
          "기다리는 손님에게 먼저 내어 줄 양배추 사라다를 준비한다.",
          "오늘 첫 주문으로 하이볼 제작을 시작한다.",
          "D4 목표: 사이드 메뉴·그릴·드링크를 함께 운영한다."
        ]
      },
      {
        "id": "SCN-D4-POST",
        "timing": "post-settlement",
        "skipSummary": [
          "양배추 사라다와 하이볼을 처음 손님상에 올렸다.",
          "늘어난 주문 속에서 세 스테이션을 끝까지 운영했다.",
          "가게에 이어 갈 리듬이 생기기 시작했다."
        ]
      }
    ],
    "skipSummary": [
      "양배추 사라다를 무료 사이드 메뉴로 제공한다.",
      "하이볼을 직접 만들어 제공한다.",
      "정산 뒤 D5 영업과 토리카와 레시피를 연다."
    ],
    "interactions": [],
    "readOnly": false,
    "gameplayCommandIds": ["begin-day", "accept-order", "select-assembly-seasoning", "brush-assembly-tare", "prepare-side-menu", "pour-highball", "serve-item", "cleanup-seat", "complete-settlement"],
    "economyCommandIds": ["record-sale", "record-tip", "apply-settlement"],
    "reward": {
      "growthResultIds": ["day-d5", "menu-kawa"],
      "storyFlagIds": ["d4-complete", "cabbage-salad-introduced", "highball-introduced"]
    }
  },
  {
    "id": "d5",
    "schemaVersion": 2,
    "displayKey": "scenario.d5",
    "active": true,
    "status": "approved",
    "kind": "business-day",
    "stage": "D5",
    "emotionKey": "닭껍질의 불맛",
    "prevDay": "d4",
    "nextDay": "d6",
    "releaseDataId": "d5-business-day-domain.v1",
    "unlocks": ["day-d5-completed"],
    "fallbackNote": "D5 토리카와는 사용자 제공 원본을 규격화한 전용 조립·그릴 에셋을 사용하며, 그을음 있는 두 번째 원본은 타레가 아닌 완벽 직전 굽기 단계로 적용한다.",
    "entryConditionId": "d4-settlement-complete",
    "completionConditionId": "d5-settlement-complete",
    "scenes": [
      {
        "id": "SCN-D5-BUSINESS",
        "timing": "pre-open",
        "skipSummary": [
          "접은 닭껍질 다섯 조각으로 토리카와를 조립한다.",
          "조립대에서 소금·타레 재고를 나누고, 타레는 그 자리에서 한 번 칠한다."
        ]
      }
    ],
    "skipSummary": [
      "토리카와를 최소 한 번 제공한다.",
      "마감과 정산을 마치면 D5 완료 상태를 저장한다."
    ],
    "interactions": [],
    "readOnly": false,
    "gameplayCommandIds": ["begin-day", "accept-order", "assemble-kawa", "select-assembly-seasoning", "brush-assembly-tare", "grill-kawa", "serve-item", "cleanup-seat", "complete-settlement"],
    "economyCommandIds": ["record-sale", "record-tip", "apply-settlement"],
    "reward": {
      "growthResultIds": ["day-d5-completed"],
      "storyFlagIds": ["d5-complete", "torikawa-introduced"]
    }
  },
  {
    "id": "d6",
    "schemaVersion": 2,
    "displayKey": "scenario.d6",
    "active": true,
    "status": "approved",
    "kind": "business-day",
    "stage": "D6",
    "emotionKey": "첫 만석",
    "prevDay": "d5",
    "nextDay": "d6-complete",
    "releaseDataId": "d6-business-day-domain.v1",
    "unlocks": [
      "day-d6-completed",
      "day-d7"
    ],
    "fallbackNote": "기존 메뉴와 기존 6석을 사용한다. 신규 도구와 D7 플레이 콘텐츠는 노출하지 않는다.",
    "entryConditionId": "d5-settlement-complete",
    "completionConditionId": "d6-settlement-complete",
    "scenes": [
      {
        "id": "SCN-D6-PREOPEN",
        "timing": "pre-open",
        "skipSummary": [
          "잔과 접시를 채우고 여섯 자리를 준비한다."
        ]
      }
    ],
    "skipSummary": [
      "익숙한 메뉴로 겹쳐 오는 손님을 맞는다.",
      "마지막 손님 퇴장과 정리를 마치고 정산한다."
    ],
    "interactions": [],
    "readOnly": false,
    "gameplayCommandIds": [
      "begin-day",
      "accept-order",
      "serve-item",
      "cleanup-seat",
      "complete-settlement"
    ],
    "economyCommandIds": [
      "record-sale",
      "record-tip",
      "apply-settlement"
    ],
    "reward": {
      "growthResultIds": [
        "day-d6-completed",
        "day-d7"
      ],